{
  "schemaVersion": 1,
  "nodes": ["engines", "workers", "atlas", "engram", "shell"],
  "agents": ["claude-code", "codex"],
  "cells": [
    {
      "node": "engines",
      "agent": "claude-code",
      "status": "supported",
      "verifiedAt": "2026-09-25",
      "verifiedBy": "owner",
      "notes": "Sí soporta nivel de razonamiento (`--effort`, 5 niveles) desde Engines 1.16.0. Revalidado el 2026-09-25 (gancho con unbound desde ~ y sin Git; ver docs/orquestacion/revalidaciones/2026-09-25-claude-code-codex.md)."
    },
    {
      "node": "workers",
      "agent": "claude-code",
      "status": "supported",
      "verifiedAt": "2026-09-22",
      "verifiedBy": "owner",
      "notes": "Auth por suscripción funciona con cwd aislado y HOME real intacto."
    },
    {
      "node": "atlas",
      "agent": "claude-code",
      "status": "supported",
      "verifiedAt": "2026-09-22",
      "verifiedBy": "owner",
      "notes": ""
    },
    {
      "node": "engram",
      "agent": "claude-code",
      "status": "supported",
      "verifiedAt": "2026-09-26",
      "verifiedBy": "owner",
      "notes": "No requiere cambios en Engram (protocolo v1). Revalidado el 2026-09-26 con Engram 1.7.2 (manual v4 con la regla 3 nueva y sessionNotice; ver T4 y T4b en docs/orquestacion/revalidaciones/2026-09-25-claude-code-codex.md)."
    },
    {
      "node": "shell",
      "agent": "claude-code",
      "status": "supported",
      "verifiedAt": "2026-09-25",
      "verifiedBy": "owner",
      "notes": "Onboarding de claude setup-token no diseñado aún. Revalidado el 2026-09-25 (Shell desde ~ y desde una carpeta sin Git con memoria compartida, y /compact; ver el plan docs/superpowers/plans/2026-09-25-revalidacion-matriz-claude-code-codex.md, cierre de R2)."
    },
    {
      "node": "engines",
      "agent": "codex",
      "status": "supported",
      "verifiedAt": "2026-09-25",
      "verifiedBy": "owner",
      "notes": "Sí soporta nivel de razonamiento (model_reasoning_effort). Revalidado el 2026-09-25 (gancho con unbound desde ~ y sin Git; ver docs/orquestacion/revalidaciones/2026-09-25-claude-code-codex.md)."
    },
    {
      "node": "workers",
      "agent": "codex",
      "status": "supported",
      "verifiedAt": "2026-09-22",
      "verifiedBy": "owner",
      "notes": "Necesita --skip-git-repo-check porque rechaza correr en carpetas no confiables."
    },
    {
      "node": "atlas",
      "agent": "codex",
      "status": "supported",
      "verifiedAt": "2026-09-22",
      "verifiedBy": "owner",
      "notes": ""
    },
    {
      "node": "engram",
      "agent": "codex",
      "status": "supported",
      "verifiedAt": "2026-09-26",
      "verifiedBy": "owner",
      "notes": "Revalidado el 2026-09-26 con Engram 1.7.2 (manual v4 con la regla 3 nueva y sessionNotice; P8′ aprobada en T4, ver T4 y T4b en docs/orquestacion/revalidaciones/2026-09-25-claude-code-codex.md). Límite: dice que la sesión quedó abierta, casi siempre cuándo (5 de 6) y cuenta su resumen, pero no ofrece continuar desde él (0 de 6); si quieres seguir o saber la hora, pídeselo. No toma las instrucciones del servidor MCP: el manual completo en AGENTS.md es obligatorio."
    },
    {
      "node": "shell",
      "agent": "codex",
      "status": "supported",
      "verifiedAt": "2026-09-25",
      "verifiedBy": "owner",
      "notes": "Revalidado el 2026-09-25 (Shell desde ~ y desde una carpeta sin Git con memoria compartida, y /compact; ver el plan docs/superpowers/plans/2026-09-25-revalidacion-matriz-claude-code-codex.md, cierre de R2)."
    }
  ]
}
